{
  "description": "Other Cells gather to aid when its HP becomes\nhalf or less. Then the Pok\u00e9mon changes\nits form to Complete Forme.",
  "effect": "Transforms 10% or 50% Zygarde into Complete Forme when its HP is below 50%.\n\nThis ability cannot be copied or replaced.  This ability only takes effect for Zygarde.",
  "id": 211,
  "name": "power-construct",
  "pokemon": [
    {
      "name": "zygarde",
      "url": "https://thepokeapi.com/pokemon/zygarde",
      "is_hidden": false,
      "slot": 1
    },
    {
      "name": "zygarde",
      "url": "https://thepokeapi.com/pokemon/zygarde",
      "is_hidden": false,
      "slot": 1
    },
    {
      "name": "zygarde",
      "url": "https://thepokeapi.com/pokemon/zygarde",
      "is_hidden": false,
      "slot": 1
    }
  ],
  "short_effect": "Transforms 10% or 50% Zygarde into Complete Forme when its HP is below 50%."
}