{
  "description": "\u307f\u304b\u305f\u306e\u3000\u304f\u3055\u30dd\u30b1\u30e2\u30f3\u306f\n\u306e\u3046\u308a\u3087\u304f\u304c\u3000\u3055\u304c\u3089\u306a\u3044\u3002",
  "effect": "Protects friendly grass Pok\u00e9mon from having their stats lowered by other Pok\u00e9mon.",
  "id": 166,
  "name": "flower-veil",
  "pokemon": [
    {
      "name": "flabebe",
      "url": "https://thepokeapi.com/pokemon/flabebe",
      "is_hidden": false,
      "slot": 1
    },
    {
      "name": "floette",
      "url": "https://thepokeapi.com/pokemon/floette",
      "is_hidden": false,
      "slot": 1
    },
    {
      "name": "florges",
      "url": "https://thepokeapi.com/pokemon/florges",
      "is_hidden": false,
      "slot": 1
    },
    {
      "name": "comfey",
      "url": "https://thepokeapi.com/pokemon/comfey",
      "is_hidden": false,
      "slot": 1
    },
    {
      "name": "floette",
      "url": "https://thepokeapi.com/pokemon/floette",
      "is_hidden": false,
      "slot": 1
    }
  ],
  "short_effect": "Protects friendly grass Pok\u00e9mon from having their stats lowered by other Pok\u00e9mon."
}