{
  "description": "Ups FIRE moves in a pinch.",
  "effect": "When this Pok\u00e9mon has 1/3 or less of its HP remaining, its fire-type moves inflict 1.5\u00d7 as much regular damage.",
  "id": 66,
  "name": "blaze",
  "pokemon": [
    {
      "name": "charmander",
      "url": "https://thepokeapi.com/pokemon/charmander",
      "is_hidden": false,
      "slot": 1
    },
    {
      "name": "charmeleon",
      "url": "https://thepokeapi.com/pokemon/charmeleon",
      "is_hidden": false,
      "slot": 1
    },
    {
      "name": "charizard",
      "url": "https://thepokeapi.com/pokemon/charizard",
      "is_hidden": false,
      "slot": 1
    },
    {
      "name": "cyndaquil",
      "url": "https://thepokeapi.com/pokemon/cyndaquil",
      "is_hidden": false,
      "slot": 1
    },
    {
      "name": "quilava",
      "url": "https://thepokeapi.com/pokemon/quilava",
      "is_hidden": false,
      "slot": 1
    },
    {
      "name": "typhlosion",
      "url": "https://thepokeapi.com/pokemon/typhlosion",
      "is_hidden": false,
      "slot": 1
    },
    {
      "name": "torchic",
      "url": "https://thepokeapi.com/pokemon/torchic",
      "is_hidden": false,
      "slot": 1
    },
    {
      "name": "combusken",
      "url": "https://thepokeapi.com/pokemon/combusken",
      "is_hidden": false,
      "slot": 1
    },
    {
      "name": "blaziken",
      "url": "https://thepokeapi.com/pokemon/blaziken",
      "is_hidden": false,
      "slot": 1
    },
    {
      "name": "chimchar",
      "url": "https://thepokeapi.com/pokemon/chimchar",
      "is_hidden": false,
      "slot": 1
    },
    {
      "name": "monferno",
      "url": "https://thepokeapi.com/pokemon/monferno",
      "is_hidden": false,
      "slot": 1
    },
    {
      "name": "infernape",
      "url": "https://thepokeapi.com/pokemon/infernape",
      "is_hidden": false,
      "slot": 1
    },
    {
      "name": "tepig",
      "url": "https://thepokeapi.com/pokemon/tepig",
      "is_hidden": false,
      "slot": 1
    },
    {
      "name": "pignite",
      "url": "https://thepokeapi.com/pokemon/pignite",
      "is_hidden": false,
      "slot": 1
    },
    {
      "name": "emboar",
      "url": "https://thepokeapi.com/pokemon/emboar",
      "is_hidden": false,
      "slot": 1
    },
    {
      "name": "pansear",
      "url": "https://thepokeapi.com/pokemon/pansear",
      "is_hidden": true,
      "slot": 3
    },
    {
      "name": "simisear",
      "url": "https://thepokeapi.com/pokemon/simisear",
      "is_hidden": true,
      "slot": 3
    },
    {
      "name": "fennekin",
      "url": "https://thepokeapi.com/pokemon/fennekin",
      "is_hidden": false,
      "slot": 1
    },
    {
      "name": "braixen",
      "url": "https://thepokeapi.com/pokemon/braixen",
      "is_hidden": false,
      "slot": 1
    },
    {
      "name": "delphox",
      "url": "https://thepokeapi.com/pokemon/delphox",
      "is_hidden": false,
      "slot": 1
    },
    {
      "name": "litten",
      "url": "https://thepokeapi.com/pokemon/litten",
      "is_hidden": false,
      "slot": 1
    },
    {
      "name": "torracat",
      "url": "https://thepokeapi.com/pokemon/torracat",
      "is_hidden": false,
      "slot": 1
    },
    {
      "name": "incineroar",
      "url": "https://thepokeapi.com/pokemon/incineroar",
      "is_hidden": false,
      "slot": 1
    },
    {
      "name": "scorbunny",
      "url": "https://thepokeapi.com/pokemon/scorbunny",
      "is_hidden": false,
      "slot": 1
    },
    {
      "name": "raboot",
      "url": "https://thepokeapi.com/pokemon/raboot",
      "is_hidden": false,
      "slot": 1
    },
    {
      "name": "cinderace",
      "url": "https://thepokeapi.com/pokemon/cinderace",
      "is_hidden": false,
      "slot": 1
    },
    {
      "name": "charizard",
      "url": "https://thepokeapi.com/pokemon/charizard",
      "is_hidden": false,
      "slot": 1
    },
    {
      "name": "cinderace",
      "url": "https://thepokeapi.com/pokemon/cinderace",
      "is_hidden": false,
      "slot": 1
    }
  ],
  "short_effect": "Strengthens fire moves to inflict 1.5\u00d7 damage at 1/3 max HP or less."
}