{
  "description": "Defeating an opposing Pok\u00e9mon strengthens the\nPok\u00e9mon\u2019s bond with its Trainer, and it becomes\nAsh-Greninja. Water Shuriken gets more powerful.",
  "effect": "Transforms this Pok\u00e9mon into Ash-Greninja after fainting an opponent.  Water Shuriken's power is 20 and always hits three times.\n\nThis ability cannot be copied or replaced.  This ability only takes effect for Greninja.",
  "id": 210,
  "name": "battle-bond",
  "pokemon": [
    {
      "name": "greninja",
      "url": "https://thepokeapi.com/pokemon/greninja",
      "is_hidden": false,
      "slot": 1
    },
    {
      "name": "greninja",
      "url": "https://thepokeapi.com/pokemon/greninja",
      "is_hidden": false,
      "slot": 1
    }
  ],
  "short_effect": "Transforms this Pok\u00e9mon into Ash-Greninja after fainting an opponent.  Water Shuriken's power is 20 and always hits three times."
}