{
  "description": "Ensures the Pok\u00e9mon and\nits foe\u2019s attacks land.",
  "effect": "Moves used by or against this Pok\u00e9mon never miss.\n\nOne-hit KO moves are unaffected.  Moves affected by this ability can hit Pok\u00e9mon during the preparation turn of moves like dig or fly.\n\nOverworld: If the lead Pok\u00e9mon has this ability, the wild encounter rate is doubled.",
  "id": 99,
  "name": "no-guard",
  "pokemon": [
    {
      "name": "machop",
      "url": "https://thepokeapi.com/pokemon/machop",
      "is_hidden": false,
      "slot": 2
    },
    {
      "name": "machoke",
      "url": "https://thepokeapi.com/pokemon/machoke",
      "is_hidden": false,
      "slot": 2
    },
    {
      "name": "machamp",
      "url": "https://thepokeapi.com/pokemon/machamp",
      "is_hidden": false,
      "slot": 2
    },
    {
      "name": "karrablast",
      "url": "https://thepokeapi.com/pokemon/karrablast",
      "is_hidden": true,
      "slot": 3
    },
    {
      "name": "golett",
      "url": "https://thepokeapi.com/pokemon/golett",
      "is_hidden": true,
      "slot": 3
    },
    {
      "name": "golurk",
      "url": "https://thepokeapi.com/pokemon/golurk",
      "is_hidden": true,
      "slot": 3
    },
    {
      "name": "honedge",
      "url": "https://thepokeapi.com/pokemon/honedge",
      "is_hidden": false,
      "slot": 1
    },
    {
      "name": "doublade",
      "url": "https://thepokeapi.com/pokemon/doublade",
      "is_hidden": false,
      "slot": 1
    },
    {
      "name": "pidgeot",
      "url": "https://thepokeapi.com/pokemon/pidgeot",
      "is_hidden": false,
      "slot": 1
    },
    {
      "name": "machamp",
      "url": "https://thepokeapi.com/pokemon/machamp",
      "is_hidden": false,
      "slot": 2
    }
  ],
  "short_effect": "Ensures all moves used by and against the Pok\u00e9mon hit."
}