{
  "description": "\uac15\ucca0\ud0c0\uc785\uc774\ub098 \ub3c5\ud0c0\uc785\ub3c4\n\ub3c5 \uc0c1\ud0dc\ub85c \ub9cc\ub4e4 \uc218 \uc788\ub2e4.",
  "effect": "This Pok\u00e9mon's moves and item ignore the usual immunity of Poison and Steel Pok\u00e9mon when attempting to inflict poison.",
  "id": 212,
  "name": "corrosion",
  "pokemon": [
    {
      "name": "salandit",
      "url": "https://thepokeapi.com/pokemon/salandit",
      "is_hidden": false,
      "slot": 1
    },
    {
      "name": "salazzle",
      "url": "https://thepokeapi.com/pokemon/salazzle",
      "is_hidden": false,
      "slot": 1
    },
    {
      "name": "salazzle",
      "url": "https://thepokeapi.com/pokemon/salazzle",
      "is_hidden": false,
      "slot": 1
    }
  ],
  "short_effect": "This Pok\u00e9mon can inflict poison on Poison and Steel Pok\u00e9mon."
}