{
  "description": "The Pok\u00e9mon boosts its most proficient stat each\ntime it knocks out a Pok\u00e9mon.",
  "effect": "Raises this Pok\u00e9mon's highest stat by one stage when it faints another Pok\u00e9mon.",
  "id": 224,
  "name": "beast-boost",
  "pokemon": [
    {
      "name": "nihilego",
      "url": "https://thepokeapi.com/pokemon/nihilego",
      "is_hidden": false,
      "slot": 1
    },
    {
      "name": "buzzwole",
      "url": "https://thepokeapi.com/pokemon/buzzwole",
      "is_hidden": false,
      "slot": 1
    },
    {
      "name": "pheromosa",
      "url": "https://thepokeapi.com/pokemon/pheromosa",
      "is_hidden": false,
      "slot": 1
    },
    {
      "name": "xurkitree",
      "url": "https://thepokeapi.com/pokemon/xurkitree",
      "is_hidden": false,
      "slot": 1
    },
    {
      "name": "celesteela",
      "url": "https://thepokeapi.com/pokemon/celesteela",
      "is_hidden": false,
      "slot": 1
    },
    {
      "name": "kartana",
      "url": "https://thepokeapi.com/pokemon/kartana",
      "is_hidden": false,
      "slot": 1
    },
    {
      "name": "guzzlord",
      "url": "https://thepokeapi.com/pokemon/guzzlord",
      "is_hidden": false,
      "slot": 1
    },
    {
      "name": "poipole",
      "url": "https://thepokeapi.com/pokemon/poipole",
      "is_hidden": false,
      "slot": 1
    },
    {
      "name": "naganadel",
      "url": "https://thepokeapi.com/pokemon/naganadel",
      "is_hidden": false,
      "slot": 1
    },
    {
      "name": "stakataka",
      "url": "https://thepokeapi.com/pokemon/stakataka",
      "is_hidden": false,
      "slot": 1
    },
    {
      "name": "blacephalon",
      "url": "https://thepokeapi.com/pokemon/blacephalon",
      "is_hidden": false,
      "slot": 1
    }
  ],
  "short_effect": "Raises this Pok\u00e9mon's highest stat by one stage when it faints another Pok\u00e9mon."
}