{
  "description": "Powers up \u201cnot very\neffective\u201d moves.",
  "effect": "This Pok\u00e9mon deals twice as much damage with moves that are not very effective against the target.",
  "id": 110,
  "name": "tinted-lens",
  "pokemon": [
    {
      "name": "butterfree",
      "url": "https://thepokeapi.com/pokemon/butterfree",
      "is_hidden": true,
      "slot": 3
    },
    {
      "name": "venonat",
      "url": "https://thepokeapi.com/pokemon/venonat",
      "is_hidden": false,
      "slot": 2
    },
    {
      "name": "venomoth",
      "url": "https://thepokeapi.com/pokemon/venomoth",
      "is_hidden": false,
      "slot": 2
    },
    {
      "name": "hoothoot",
      "url": "https://thepokeapi.com/pokemon/hoothoot",
      "is_hidden": true,
      "slot": 3
    },
    {
      "name": "noctowl",
      "url": "https://thepokeapi.com/pokemon/noctowl",
      "is_hidden": true,
      "slot": 3
    },
    {
      "name": "illumise",
      "url": "https://thepokeapi.com/pokemon/illumise",
      "is_hidden": false,
      "slot": 2
    },
    {
      "name": "mothim",
      "url": "https://thepokeapi.com/pokemon/mothim",
      "is_hidden": true,
      "slot": 3
    },
    {
      "name": "yanmega",
      "url": "https://thepokeapi.com/pokemon/yanmega",
      "is_hidden": false,
      "slot": 2
    },
    {
      "name": "sigilyph",
      "url": "https://thepokeapi.com/pokemon/sigilyph",
      "is_hidden": true,
      "slot": 3
    },
    {
      "name": "butterfree",
      "url": "https://thepokeapi.com/pokemon/butterfree",
      "is_hidden": true,
      "slot": 3
    }
  ],
  "short_effect": "Doubles damage inflicted with not-very-effective moves."
}