{
  "description": "Infatuates on contact.",
  "effect": "Whenever a move makes contact with this Pok\u00e9mon, the move's user has a 30% chance of being infatuated.\n\nOverworld: If the first Pok\u00e9mon in the party has this ability, any wild Pok\u00e9mon whose species can be either gender has a 2/3 chance of being set to the opposite gender, and a 1/3 chance of having a random gender as usual.",
  "id": 56,
  "name": "cute-charm",
  "pokemon": [
    {
      "name": "clefairy",
      "url": "https://thepokeapi.com/pokemon/clefairy",
      "is_hidden": false,
      "slot": 1
    },
    {
      "name": "clefable",
      "url": "https://thepokeapi.com/pokemon/clefable",
      "is_hidden": false,
      "slot": 1
    },
    {
      "name": "jigglypuff",
      "url": "https://thepokeapi.com/pokemon/jigglypuff",
      "is_hidden": false,
      "slot": 1
    },
    {
      "name": "wigglytuff",
      "url": "https://thepokeapi.com/pokemon/wigglytuff",
      "is_hidden": false,
      "slot": 1
    },
    {
      "name": "cleffa",
      "url": "https://thepokeapi.com/pokemon/cleffa",
      "is_hidden": false,
      "slot": 1
    },
    {
      "name": "igglybuff",
      "url": "https://thepokeapi.com/pokemon/igglybuff",
      "is_hidden": false,
      "slot": 1
    },
    {
      "name": "skitty",
      "url": "https://thepokeapi.com/pokemon/skitty",
      "is_hidden": false,
      "slot": 1
    },
    {
      "name": "delcatty",
      "url": "https://thepokeapi.com/pokemon/delcatty",
      "is_hidden": false,
      "slot": 1
    },
    {
      "name": "milotic",
      "url": "https://thepokeapi.com/pokemon/milotic",
      "is_hidden": true,
      "slot": 3
    },
    {
      "name": "lopunny",
      "url": "https://thepokeapi.com/pokemon/lopunny",
      "is_hidden": false,
      "slot": 1
    },
    {
      "name": "minccino",
      "url": "https://thepokeapi.com/pokemon/minccino",
      "is_hidden": false,
      "slot": 1
    },
    {
      "name": "cinccino",
      "url": "https://thepokeapi.com/pokemon/cinccino",
      "is_hidden": false,
      "slot": 1
    },
    {
      "name": "sylveon",
      "url": "https://thepokeapi.com/pokemon/sylveon",
      "is_hidden": false,
      "slot": 1
    },
    {
      "name": "stufful",
      "url": "https://thepokeapi.com/pokemon/stufful",
      "is_hidden": true,
      "slot": 3
    }
  ],
  "short_effect": "Has a 30% chance of infatuating attacking Pok\u00e9mon on contact."
}