{
  "description": "Boosts the Pok\u00e9mon\u2019s Defense stat sharply when hit\nby a Water-type move.",
  "effect": "Raises this Pok\u00e9mon's Defense by two stages when it's hit by a Water move.",
  "id": 195,
  "name": "water-compaction",
  "pokemon": [
    {
      "name": "sandygast",
      "url": "https://thepokeapi.com/pokemon/sandygast",
      "is_hidden": false,
      "slot": 1
    },
    {
      "name": "palossand",
      "url": "https://thepokeapi.com/pokemon/palossand",
      "is_hidden": false,
      "slot": 1
    }
  ],
  "short_effect": "Raises this Pok\u00e9mon's Defense by two stages when it's hit by a Water move."
}