{
  "description": "The Pok\u00e9mon can poison the target even if it\u2019s\na Steel or Poison type.",
  "effect": "This Pok\u00e9mon's moves and item ignore the usual immunity of Poison and Steel Pok\u00e9mon when attempting to inflict poison.",
  "id": 212,
  "name": "corrosion",
  "pokemon": [
    {
      "name": "salandit",
      "url": "https://thepokeapi.com/pokemon/salandit",
      "is_hidden": false,
      "slot": 1
    },
    {
      "name": "salazzle",
      "url": "https://thepokeapi.com/pokemon/salazzle",
      "is_hidden": false,
      "slot": 1
    },
    {
      "name": "salazzle",
      "url": "https://thepokeapi.com/pokemon/salazzle",
      "is_hidden": false,
      "slot": 1
    }
  ],
  "short_effect": "This Pok\u00e9mon can inflict poison on Poison and Steel Pok\u00e9mon."
}