{
  "description": "\u307f\u304b\u305f\u306e\u3000\u3068\u304f\u3057\u3085\u308f\u3056\u306e\n\u3044\u308a\u3087\u304f\u3092\u3000\u3042\u3052\u308b\u3002",
  "effect": "Ally Pok\u00e9mon's moves have their power increased to 1.3\u00d7.",
  "id": 217,
  "name": "battery",
  "pokemon": [
    {
      "name": "charjabug",
      "url": "https://thepokeapi.com/pokemon/charjabug",
      "is_hidden": false,
      "slot": 1
    }
  ],
  "short_effect": "Ally Pok\u00e9mon's moves have their power increased to 1.3\u00d7."
}