{
  "description": "Gives priority to a healing move.",
  "effect": "This Pok\u00e9mon's healing moves have their priority increased by 3.",
  "id": 205,
  "name": "triage",
  "pokemon": [
    {
      "name": "comfey",
      "url": "https://thepokeapi.com/pokemon/comfey",
      "is_hidden": false,
      "slot": 2
    }
  ],
  "short_effect": "This Pok\u00e9mon's healing moves have their priority increased by 3."
}