{
  "description": "Leaves spores on contact.",
  "effect": "Whenever a move makes contact with this Pok\u00e9mon, the move's user has a 30% chance of being paralyzed, poisoned, or put to sleep, chosen at random.\n\nNothing is done to compensate if the move's user is immune to one of these ailments; there is simply a lower chance that the move's user will be affected.",
  "id": 27,
  "name": "effect-spore",
  "pokemon": [
    {
      "name": "vileplume",
      "url": "https://thepokeapi.com/pokemon/vileplume",
      "is_hidden": true,
      "slot": 3
    },
    {
      "name": "paras",
      "url": "https://thepokeapi.com/pokemon/paras",
      "is_hidden": false,
      "slot": 1
    },
    {
      "name": "parasect",
      "url": "https://thepokeapi.com/pokemon/parasect",
      "is_hidden": false,
      "slot": 1
    },
    {
      "name": "shroomish",
      "url": "https://thepokeapi.com/pokemon/shroomish",
      "is_hidden": false,
      "slot": 1
    },
    {
      "name": "breloom",
      "url": "https://thepokeapi.com/pokemon/breloom",
      "is_hidden": false,
      "slot": 1
    },
    {
      "name": "foongus",
      "url": "https://thepokeapi.com/pokemon/foongus",
      "is_hidden": false,
      "slot": 1
    },
    {
      "name": "amoonguss",
      "url": "https://thepokeapi.com/pokemon/amoonguss",
      "is_hidden": false,
      "slot": 1
    },
    {
      "name": "morelull",
      "url": "https://thepokeapi.com/pokemon/morelull",
      "is_hidden": false,
      "slot": 2
    },
    {
      "name": "shiinotic",
      "url": "https://thepokeapi.com/pokemon/shiinotic",
      "is_hidden": false,
      "slot": 2
    },
    {
      "name": "gossifleur",
      "url": "https://thepokeapi.com/pokemon/gossifleur",
      "is_hidden": true,
      "slot": 3
    },
    {
      "name": "eldegoss",
      "url": "https://thepokeapi.com/pokemon/eldegoss",
      "is_hidden": true,
      "slot": 3
    }
  ],
  "short_effect": "Has a 30% chance of inflcting either paralysis, poison, or sleep on attacking Pok\u00e9mon on contact."
}