{
  "description": "\u307f\u305a\u3092\u3000\u53d7\u3051\u308b\u3068\n\u56de\u5fa9\u3059\u308b\u3002",
  "effect": "Whenever a water-type move hits this Pok\u00e9mon, it heals for 1/4 of its maximum HP, negating any other effect on it.\n\nWater moves will ignore this Pok\u00e9mon's substitute.",
  "id": 11,
  "name": "water-absorb",
  "pokemon": [
    {
      "name": "poliwag",
      "url": "https://thepokeapi.com/pokemon/poliwag",
      "is_hidden": false,
      "slot": 1
    },
    {
      "name": "poliwhirl",
      "url": "https://thepokeapi.com/pokemon/poliwhirl",
      "is_hidden": false,
      "slot": 1
    },
    {
      "name": "poliwrath",
      "url": "https://thepokeapi.com/pokemon/poliwrath",
      "is_hidden": false,
      "slot": 1
    },
    {
      "name": "lapras",
      "url": "https://thepokeapi.com/pokemon/lapras",
      "is_hidden": false,
      "slot": 1
    },
    {
      "name": "vaporeon",
      "url": "https://thepokeapi.com/pokemon/vaporeon",
      "is_hidden": false,
      "slot": 1
    },
    {
      "name": "chinchou",
      "url": "https://thepokeapi.com/pokemon/chinchou",
      "is_hidden": true,
      "slot": 3
    },
    {
      "name": "lanturn",
      "url": "https://thepokeapi.com/pokemon/lanturn",
      "is_hidden": true,
      "slot": 3
    },
    {
      "name": "politoed",
      "url": "https://thepokeapi.com/pokemon/politoed",
      "is_hidden": false,
      "slot": 1
    },
    {
      "name": "wooper",
      "url": "https://thepokeapi.com/pokemon/wooper",
      "is_hidden": false,
      "slot": 2
    },
    {
      "name": "quagsire",
      "url": "https://thepokeapi.com/pokemon/quagsire",
      "is_hidden": false,
      "slot": 2
    },
    {
      "name": "mantine",
      "url": "https://thepokeapi.com/pokemon/mantine",
      "is_hidden": false,
      "slot": 2
    },
    {
      "name": "cacnea",
      "url": "https://thepokeapi.com/pokemon/cacnea",
      "is_hidden": true,
      "slot": 3
    },
    {
      "name": "cacturne",
      "url": "https://thepokeapi.com/pokemon/cacturne",
      "is_hidden": true,
      "slot": 3
    },
    {
      "name": "mantyke",
      "url": "https://thepokeapi.com/pokemon/mantyke",
      "is_hidden": false,
      "slot": 2
    },
    {
      "name": "tympole",
      "url": "https://thepokeapi.com/pokemon/tympole",
      "is_hidden": true,
      "slot": 3
    },
    {
      "name": "palpitoad",
      "url": "https://thepokeapi.com/pokemon/palpitoad",
      "is_hidden": true,
      "slot": 3
    },
    {
      "name": "seismitoad",
      "url": "https://thepokeapi.com/pokemon/seismitoad",
      "is_hidden": true,
      "slot": 3
    },
    {
      "name": "maractus",
      "url": "https://thepokeapi.com/pokemon/maractus",
      "is_hidden": false,
      "slot": 1
    },
    {
      "name": "frillish",
      "url": "https://thepokeapi.com/pokemon/frillish",
      "is_hidden": false,
      "slot": 1
    },
    {
      "name": "jellicent",
      "url": "https://thepokeapi.com/pokemon/jellicent",
      "is_hidden": false,
      "slot": 1
    },
    {
      "name": "volcanion",
      "url": "https://thepokeapi.com/pokemon/volcanion",
      "is_hidden": false,
      "slot": 1
    },
    {
      "name": "dewpider",
      "url": "https://thepokeapi.com/pokemon/dewpider",
      "is_hidden": true,
      "slot": 3
    },
    {
      "name": "araquanid",
      "url": "https://thepokeapi.com/pokemon/araquanid",
      "is_hidden": true,
      "slot": 3
    },
    {
      "name": "dracovish",
      "url": "https://thepokeapi.com/pokemon/dracovish",
      "is_hidden": false,
      "slot": 1
    },
    {
      "name": "arctovish",
      "url": "https://thepokeapi.com/pokemon/arctovish",
      "is_hidden": false,
      "slot": 1
    },
    {
      "name": "araquanid",
      "url": "https://thepokeapi.com/pokemon/araquanid",
      "is_hidden": true,
      "slot": 3
    },
    {
      "name": "lapras",
      "url": "https://thepokeapi.com/pokemon/lapras",
      "is_hidden": false,
      "slot": 1
    }
  ],
  "short_effect": "Absorbs water moves, healing for 1/4 max HP."
}